{
  "schemaVersion": 1,
  "interfaceSetId": "PF-05",
  "version": "0.1.0",
  "caseStatus": "fictional-synthetic",
  "boundaries": [
    {"name":"query","owner":"Product application","trust":"untrusted","stateOwner":"Request service","validator":"query-v1","failureDisposition":"block","authority":"Authenticated user and product scope"},
    {"name":"candidate","owner":"Retrieval service","trust":"validated-data","stateOwner":"Retrieval service","validator":"candidate-v1","failureDisposition":"abstain","authority":"Catalog permission policy"},
    {"name":"rankedResult","owner":"Ranking service","trust":"validated-data","stateOwner":"Orchestrator","validator":"ranked-result-v1","failureDisposition":"abstain","authority":"Compatibility policy"},
    {"name":"policy","owner":"Policy service","trust":"deterministic-control","stateOwner":"Policy service","validator":"policy-decision-v1","failureDisposition":"block","authority":"Catalog domain owner"},
    {"name":"explanation","owner":"Explanation adapter","trust":"untrusted","stateOwner":"Orchestrator","validator":"explanation-v1","failureDisposition":"degrade","authority":"Product presentation policy"},
    {"name":"toolProposal","owner":"Draft tool adapter","trust":"untrusted","stateOwner":"Tool gateway","validator":"tool-proposal-v1","failureDisposition":"block","authority":"Explicit user confirmation"},
    {"name":"trace","owner":"Trace recorder","trust":"evidence-record","stateOwner":"Trace store","validator":"trace-v1","failureDisposition":"diagnose-only","authority":"Privacy and operations owners"},
    {"name":"providerAdapter","owner":"Applied AI engineering","trust":"untrusted","stateOwner":"Adapter boundary","validator":"provider-envelope-v1","failureDisposition":"degrade","authority":"Release owner"}
  ]
}
